{
  "assignment_id": "HW2",
  "student_id": "synth_hw2_trial_002",
  "seed": 149650775297937,
  "num_qubits": 3,
  "input_bits_q0_to_qn": [
    0,
    1,
    1
  ],
  "measurement_mode": "reversed",
  "measurement_map": [
    [
      0,
      2
    ],
    [
      1,
      1
    ],
    [
      2,
      0
    ]
  ],
  "expected_logical_qn_to_q0": "110",
  "expected_display_bitstring": "011",
  "shots": 2048,
  "counts": {
    "011": 2048
  },
  "dominant_bitstring": "011",
  "original_depth": 17,
  "transpiled_depth_simulator": 17,
  "operation_counts_simulator": {
    "h": 6,
    "cp": 6,
    "barrier": 3,
    "measure": 3,
    "x": 2,
    "swap": 2
  },
  "hardware_attempted": false,
  "hardware_backend": null,
  "hardware_job_id": null,
  "hardware_counts": null,
  "hardware_dominant_bitstring": null,
  "hardware_expected_percentage": null,
  "hardware_original_depth": null,
  "hardware_transpiled_depth": null,
  "hardware_operation_counts": null,
  "reflection_qft_recovery": "QFT followed by inverse QFT recovers the original computational basis state because the inverse QFT exactly undoes the QFT. For my seeded input, the recovered logical qubit string is 110, and the ideal simulator result is concentrated on the expected displayed bitstring 011.",
  "reflection_bit_order": "The input bits are listed in q[0]...q[n-1] order, but Qiskit displays count keys in c[n-1]...c[0] order. My measurement map is reversed, so q0 is stored in c2, q1 in c1, and q2 in c0. Therefore logical q2q1q0 = 110 is displayed as c2c1c0 = 011.",
  "reflection_hardware_noise": "On real IBM hardware, QFT and inverse QFT require imperfect gates and measurements, so outcomes other than the expected bitstring can appear. Controlled-phase operations, routing/transpilation overhead, decoherence, and readout error can reduce the expected bitstring percentage even though the ideal circuit should recover the input exactly."
}
